{
  "manifest_version": 1,
  "id": "writer",
  "name": "Text Writer / Synthesizer",
  "version": "1.1.0",
  "description": "Text synthesis, drafting e-mails and other texts",
  "author": "Hapilot Team",
  "license": "MIT",
  "enabled": true,
  "nodes": [
    {
      "name": "writer",
      "entry_point": "nodes:run_writer",
      "label": "✍️ Redakcja tekstu",
      "description": "Synteza i redakcja tekstu formalnego"
    }
  ],
  "tools": [
    {
      "name": "llm_synthesis",
      "description": "Napisanie, przeredagowanie lub podsumowanie tekstu przez model językowy",
      "when_to_use": "Odpowiedź na podstawie wyników poprzednich kroków, e-mail lub notatka jako tekst w czacie, przeredagowanie poprzedniej odpowiedzi („krócej”, „prościej”)",
      "when_not_to_use": "Gdy użytkownik chce pliku PDF (użyj template_pdf)",
      "example": "„Co robić w razie awarii serwera?” → rag_search, potem llm_synthesis",
      "aliases": [
        "email"
      ]
    }
  ],
  "prompts": {
    "writer": "prompts/writer.txt"
  }
}
