{
  "manifest_version": 1,
  "id": "n8n_operations",
  "name": "n8n Office Operations",
  "version": "1.1.0",
  "description": "Optional: Outlook e-mail drafts (never sent) and calendar look-ups through a local n8n. Off by default.",
  "author": "Hapilot Team",
  "license": "MIT",
  "enabled": false,
  "nodes": [
    {
      "name": "operations",
      "entry_point": "nodes:run_operations",
      "label": "📅 Kalendarz / e-mail (n8n)",
      "description": "Wersja robocza e-maila w Outlooku (po potwierdzeniu) lub sprawdzenie kalendarza"
    }
  ],
  "tools": [
    {
      "name": "email",
      "description": "Wersja robocza e-maila w Outlooku, tworzona dopiero po potwierdzeniu użytkownika (nic nie jest wysyłane)",
      "when_to_use": "Użytkownik chce przygotować e-mail w swojej skrzynce",
      "example": "„Przygotuj w Outlooku maila do Anny o spotkaniu” → email"
    },
    {
      "name": "calendar",
      "description": "Wydarzenia z kalendarza Outlook na wskazany dzień",
      "when_to_use": "Sprawdzenie dostępności, spotkań lub planu dnia",
      "example": "„Co mam jutro w kalendarzu?” → calendar"
    }
  ],
  "prompts": {}
}
