{
  "manifest_version": 1,
  "id": "chat",
  "name": "Chat / Conversation",
  "version": "1.1.0",
  "description": "General conversation and casual interaction",
  "author": "Hapilot Team",
  "license": "MIT",
  "enabled": true,
  "nodes": [
    {
      "name": "chat",
      "entry_point": "nodes:run_chat",
      "label": "💬 Odpowiedź asystenta",
      "description": "Generowanie odpowiedzi konwersacyjnej"
    }
  ],
  "tools": [
    {
      "name": "chat",
      "description": "Zwykła rozmowa z użytkownikiem",
      "when_to_use": "Powitania, luźna rozmowa, podziękowania, zgoda lub odmowa, pytania o samego asystenta",
      "when_not_to_use": "Pytania o procedury, umowy, cenniki lub inne fakty z dokumentów firmy (użyj rag_search)",
      "example": "„Jak tam dzień minął?” → chat"
    }
  ],
  "prompts": {
    "chat": "prompts/chat.txt"
  }
}
